{
  "accommodations": [],
  "cities": [
    "Paris",
    "Lisbon"
  ],
  "document_type": "air_ticket",
  "pdf_kind": "text",
  "prices": [
    {
      "amount": 149.5,
      "currency": "EUR"
    }
  ],
  "qr_codes": [
    "AIRTKT-01-air-out-hotel-back-paris-lisbon-1pax/01-air-leg-1-01"
  ],
  "scenario_id": "01-air-out-hotel-back-paris-lisbon-1pax/01-air-leg-1",
  "stations": [
    {
      "city": "Paris",
      "departure_datetime": "2027-03-11T08:30:00",
      "identifier": "CDG",
      "kind": "airport"
    },
    {
      "arrival_datetime": "2027-03-11T10:45:00",
      "city": "Lisbon",
      "identifier": "LIS",
      "kind": "airport"
    }
  ],
  "travelers": [
    "Ines Marques"
  ],
  "venues": []
}
