{
  "accommodations": [],
  "cities": [
    "Paris",
    "Lisbon"
  ],
  "document_type": "air_ticket",
  "noise_seed": 8118109862160535515,
  "pdf_kind": "text",
  "prices": [
    {
      "amount": 346.56,
      "currency": "GBP"
    }
  ],
  "qr_codes": [
    "AIRTKT-004-air-return-2pax-paris-lisbon-01",
    "AIRTKT-004-air-return-2pax-paris-lisbon-02"
  ],
  "scenario_id": "004-air-return-2pax-paris-lisbon",
  "stations": [
    {
      "city": "Paris",
      "departure_datetime": "2027-03-11T08:30:00",
      "identifier": "CDG",
      "kind": "airport"
    },
    {
      "arrival_datetime": "2027-03-11T10:45:00",
      "city": "Lisbon",
      "departure_datetime": "2027-03-15T18:15:00",
      "identifier": "LIS",
      "kind": "airport"
    },
    {
      "arrival_datetime": "2027-03-15T20:30:00",
      "city": "Paris",
      "identifier": "CDG",
      "kind": "airport"
    }
  ],
  "travelers": [
    "Bob Sample",
    "Julien Lefevre"
  ],
  "venues": []
}
