{
  "accommodations": [],
  "cities": [
    "Madrid",
    "Rome"
  ],
  "document_type": "rail_ticket",
  "noise_seed": 14149649725366583964,
  "pdf_kind": "text",
  "prices": [
    {
      "amount": 160.29,
      "currency": "EUR"
    }
  ],
  "qr_codes": [
    "RAILTKT-033-rail-1leg-1pax-madrid-rome"
  ],
  "scenario_id": "033-rail-1leg-1pax-madrid-rome",
  "stations": [
    {
      "city": "Madrid",
      "departure_datetime": "2027-03-11T07:45:00",
      "identifier": "Madrid Atocha",
      "kind": "rail_station"
    },
    {
      "arrival_datetime": "2027-03-11T10:55:00",
      "city": "Rome",
      "identifier": "Roma Termini",
      "kind": "rail_station"
    }
  ],
  "travelers": [
    "Karin Andersson"
  ],
  "venues": []
}
