{
  "accommodations": [],
  "cities": [
    "Frankfurt",
    "Amsterdam"
  ],
  "document_type": "rail_ticket",
  "noise_seed": 10589542730838783488,
  "pdf_kind": "rasterized",
  "prices": [
    {
      "amount": 102.38,
      "currency": "EUR"
    }
  ],
  "qr_codes": [
    "RAILTKT-031-rail-return-1pax-frankfurt-amsterdam"
  ],
  "scenario_id": "031-rail-return-1pax-frankfurt-amsterdam",
  "stations": [
    {
      "city": "Frankfurt",
      "departure_datetime": "2027-03-11T07:45:00",
      "identifier": "Frankfurt Hauptbahnhof",
      "kind": "rail_station"
    },
    {
      "arrival_datetime": "2027-03-11T10:55:00",
      "city": "Amsterdam",
      "departure_datetime": "2027-03-15T17:20:00",
      "identifier": "Amsterdam Centraal",
      "kind": "rail_station"
    },
    {
      "arrival_datetime": "2027-03-15T20:30:00",
      "city": "Frankfurt",
      "identifier": "Frankfurt Hauptbahnhof",
      "kind": "rail_station"
    }
  ],
  "travelers": [
    "Gabriela Rossi"
  ],
  "venues": []
}
