{
  "accommodations": [],
  "cities": [
    "Madrid"
  ],
  "document_type": "supplementary",
  "noise_seed": 2782840224370434157,
  "pdf_kind": "text",
  "prices": [
    {
      "amount": 40.25,
      "currency": "EUR"
    }
  ],
  "qr_codes": [
    "SUPP-OTHER-129-supp-other-1pax-madrid"
  ],
  "scenario_id": "129-supp-other-1pax-madrid",
  "stations": [],
  "travelers": [
    "Felix Bauer"
  ],
  "venues": [
    {
      "city": "Madrid",
      "identifier": "Castellana Loop Pass",
      "kind": "other",
      "valid_from_datetime": "2027-03-12T00:00:00",
      "valid_to_datetime": "2027-03-15T23:59:00"
    }
  ]
}
